paper id,year,paper type,paper title,author number,abstract,session title,sub unit
2014-0000,2014,Poster,Communication Can Reduce Stereotyping Behavioral Decisions,3,"Stereotypes are oversimplifications of a complex social environment, and they can contribute to a host of social problems. Based on decision science literature, we conceptualize stereotype decisions as a hybrid of both rule-based and experience-based decision process, and explore how feedback of decisions and the way we communicating categorization information during the decision process can help reduce stereotyping behavior. We designed a novel decision game experiment to study how people make interpersonal interaction decisions based on the stereotypes provided in the cover story at the beginning of the game and trial-by-trial feedback over time throughout the game. In addition, the decision trials required different communication effort for the categorization information during the decision process. Through a multilevel time series logit model, we found that communication of categorization information and feedback information can significantly reduce stereotyping behavioral decision.","Analyses of Stereotypes, Gender Roles, and Expectancy Violations in Media",Information Systems
2014-0001,2014,Poster,How Do Men and Women Self-Present in Online Business Networks: A Quantitative and Qualitative Analysis,2,"While Facebook predominantly caters for the needs of private self-expression, the self presentational features of business networking sites (BNS) like LinkedIn and XING serve more professional impression management purposes (van Dijck, 2013). Besides contact lists and (discussion) groups, these networks feature detailed information on working history, as well as categories regarding personal but job-related information but have so far largely been ignored. In the context of discussions about a wider inclusion of women in the workforce, it is worthwhile to investigate similarities and differences in the use of self-presentational resources that might have consequences with regard to visibility and hiring probability. One can expect differences between men and women resulting from gender roles and stereotypes that suggest corresponding behavioral preferences. The study analyzes similarities and differences in the profiles of men and women with regard to the outer form, quantitative aspects, and qualitative presentation, finding that there are indeed several differences.","Analyses of Stereotypes, Gender Roles, and Expectancy Violations in Media",Information Systems
2014-0002,2014,Poster,Online Interruptions: Relevancy of Media Richness Theory,3,"Media Richness Theory is one of the controversial theories in CMC research.The theory assumes that media differ in their ability to carry varied types of information and ‘Social Richness’.This study examines the role of richness of interruption messages effect on cognitive performance quality. An experimental research design utilized a computerized simulation game to measure participants' cognitive performance. 114 participants were assigned randomly to four groups and one control group. Manipulation achieved by exposing participants to messages (using ‘Push’ technology) in Mobile phones (SMS/MMS) and online application (text/banner). A significant difference between experimental groups was found regarding the time of the task. Analysis also reveals a significant effect of the richness of the message and a main effect of the media type.This research seeks to broaden our understanding of the incorporation of information technology, such as mobile phones and the Internet, as an integral part of the workplace.","Analyses of Stereotypes, Gender Roles, and Expectancy Violations in Media",Information Systems
2014-0003,2014,Poster,Online and Retrospective Negation of Media Stereotypes,2,"The present study investigated the negation (e.g., “No! This is not true!”) of media stereotypes and its consequences on media-induced changes of prejudice. This study is the first to measure negation during exposure by utilizing a process-oriented continuous measurement approach with eye tracking methodology. The data show that individuals negated the repeated depictions of the “criminal foreigner” stereotype during reception (online) as well as in a subsequent situation (retrospective). However, they rarely negated the stereotypic information directly at the moment of encoding. This is unfortunate, because scholarship has indicated that negation directly at the moment of encoding may have important beneficial consequences. In addition, this study investigated negation’s consequences on media-induced attitude change: Whereas some scholars have argued that media effects on attitudes typically occur during exposure, others highlighted the situation when the attitude judgment is constructed. Our data emphasize the importance of the judgment construction situation.","Analyses of Stereotypes, Gender Roles, and Expectancy Violations in Media",Information Systems
2014-0004,2014,Poster,Parsing Gender Gaps on News Memory Making and Decay,4,"This experiment investigated gender differences in audiovisual news acquisition by manipulating emotional personalization in stories and measuring memory and comprehension at two time points, one week apart. Data (N=80) offer evidence that gender gaps are intricate and resisted uniformity across three memory and five comprehension measures. Over time, memory decay showed up strong but without substantial gender variance. Free recall tests point to women as having an edge over men. Recognition and comprehension did not vary across gender but men were more efficient (used fewer words) than women in articulating what they learned from news. Education of participants (a control factor) revealed that highly educated women gave lengthy responses to open-ended items without improving accuracy in articulating the main point of stories. Taken together, these findings reveal the value of employing multiple memory measures to map an overview of where future gender gap studies might be productively focused.","Analyses of Stereotypes, Gender Roles, and Expectancy Violations in Media",Information Systems
2014-0005,2014,Poster,"How Gender, Conflict Linkage, Victimization, and Cardiovascular Reactivity Predict Taking Conflict Personally",2,"Taking conflict personally can lead to negative relational outcomes. In this study we examined how viewers of an escalating conflict within a couple advised and predicted what would happen next. We examined the effects of gender, imagined interaction conflict linkage in terms of persons predicting and advising if the partners should replay an escalating conflict in their mind while preparing for what should happen next, as well as past victimization and, change in cardiovascular variables including blood pressure as they correspond with viewer’s taking conflict personally. People who take conflict personally may have increased blood pressure as conflict escalates. Results indicate being female, conflict linkage, past victimization, advising escalation, and change in blood pressure are positive predictors of taking conflict personally.","Analyses of Stereotypes, Gender Roles, and Expectancy Violations in Media",Information Systems
2014-0006,2014,Poster,No Woman No Cry?: How Televised Women’s Football Affects Moods and Judgments,3,"The objective of this article is to improve the understanding of mood and judgment effects evoked by major televised sport events like national football matches. According to disposition theory of sport spectatorship, viewers’ affective experiences, specifically their moods, are assumed to be effected by the outcomes of the matches they watch. This study tests whether these mood effects depend on viewers’ team identification as well as viewers’ sex. Moreover, past research has indicated that mood changes as effects of sport viewing could influence viewers’ subsequent judgments in line with feeling-as-information theory. Based on this line of arguments, a quasi-experimental pre-post-test study with 180 participants was conducted to assess the moods and judgments (self-confidence, evaluation of the economic situation, government satisfaction) of viewers before and after a win and a defeat of the German national football team during the 2011 women’s FIFA World Cup. The results support disposition theory of sport spectatorship as well as feeling-as-information theory and give new insights into the moderating role of team identification and sex.","Analyses of Stereotypes, Gender Roles, and Expectancy Violations in Media",Information Systems
2014-0007,2014,Poster,Violating Viewers' Expectations During Narrative Processing,3,"This study investigates how violations of the expectancies viewers form during narrative processing are processed and influence the viewing experience. In a 2 (solved: yes vs. no) × 2 (message) × 4 (order) mixed repeated measures experiment 59 participants watched four stimulus clips while psychophysiological measures were being recorded, and indicated their levels of engagement and enjoyment after each clip. Results confirm that expectation violations can elicit orienting responses in viewers regardless of their level of narrative engagement and lead to more enjoyment when they are explained during the following plot. Implications for future research about narrative processing are discussed.","Analyses of Stereotypes, Gender Roles, and Expectancy Violations in Media",Information Systems
2014-0008,2014,Poster,Dimensions and Information Introduced (ii): How Information Provided Weighs Differently When Number of Visual Dimensions change,4,"Based on the limited capacity model of motivated mediated message processing, or LC4MP (Lang, 2006), Park, Lee, Lee, & Nam (2013) explored how change in dimension (2D vs. 3D) affects the cognitive load on individuals. Park et al. (2013) reported that the additional dimension in the visual field increased cognitive load for individuals to process information, which resulted more cognitive effort paid and poorer performance in information processing.
This study attempts to extend the findings from Park, Lee, Lee, & Kim (2013) by adding another concept to the picture: information introduced. Ongoing study is collecting data (target N=60) and this extended abstract will provide some of the preliminary results from data gathered to date.
Results from data collected to date shows general support for LC4MP, which suggests 3D technology leads to early cognitive overload for viewers. Implications from this finding is that structural features that consume cognitive resources needs to be used even more carefully in 3D environment in order to successfully deliver information to viewers.
an experiment has been designed using video clips varying in its density of structural features and levels of arousing content. The results provides general support for LC4MP, suggesting that additional dimension in the visual field provided by 3D technology do increase the cognitive load in processing mediated messages. To date, this project has collected data from 21 subjects, and will complete with additional forty or more (total N > 60) by ICA 2013.",Analyses of Content and Structural Features of Messages,Information Systems
2014-0009,2014,Poster,Explicating the Emotion Spillover Effect Using Motivated Information Processing Approach: Promising Evidence and Remaining Issues,1,"This manuscript reports on research conducted under the framework of motivated information processing theories with a goal of understanding the underlying mechanisms of the emotion spillover effect. The central hypothesis within this approach suggests that the emotional tone of the message preceding the to-be-remembered content influences the encoding strategy for that content by signaling to a cognitive system which motivationally relevant content should be prioritized during encoding. The framework suggests that positive emotional tone vs. negative emotional tone support different information processing strategies and as a result, they can produce different outcomes for information processing. The main propositions of the framework are described and initial empirical evidence from three experiments is reported. The results are discussed in light of theory advancement.",Analyses of Content and Structural Features of Messages,Information Systems
2014-0010,2014,Poster,How Camera Changes Affect the Recognition of Public Service Announcements: A Test Outside the Lab,2,"This study aimed at estimating the impact of camera changes on the recognition of PSAs amidst of an array of other factors affecting the attention to these ads. Recognition percentages of 193 PSAs derived from campaign evaluation studies were related to content analysis data of the ads measuring the number of camera changes per second and the information introduced per camera change. The study reveals increasing the number of camera changes may slightly increase PSA recognition if the amount of information introduced by these camera changes is small, but increasing the number of camera changes tends to decrease PSA recognition substantially as the amount of information introduced by these camera changes increases. Combined, the number of camera changes per second and the information introduced per camera change account for 5% of the variance in PSA recognition. These findings corroborate theoretical propositions from the LC4MP outside the laboratory setting.",Analyses of Content and Structural Features of Messages,Information Systems
2014-0011,2014,Poster,How Perceived Information Quality of Online News Sources Determines Political Knowledge Through Self-Efficacy,1,"The Internet is a challenging news source. Young users have to choose between so-called ‘quality media’ and diverse semi-professional or non-professional sources. We suggest that the perceived information quality of online news sources plays a crucial role in the acquisition of political knowledge. Based on self-efficacy theory (Bandura, 1977, 1986) we propose that in the course of an individual’s media socialization, perceived information quality, media self-efficacy, internal political efficacy, and political knowledge should be understood as consecutively linked.
Based on a student sample (N = 560), aged 12 to 22 (M = 16.04, SD = 1.37), our assumptions were supported for general online news exposure. Further, we examined whether the model holds true for professional, semi-professional and non-professional information sources. Here a more complex picture revealed. The results underline the importance of focusing on media literacy education as well as the development of media and internal political efficacy to trigger knowledge acquisition processes.",Analyses of Content and Structural Features of Messages,Information Systems
2014-0012,2014,Poster,"People vs. Objects in Media Texts: Effects of Content Features on Attention, Arousal, and Memory",4,"This study will test the effects of media content about either agentic subjects or inanimate objects on experimental participants’ attention, arousal, and memory. The study uses a 2 (topic: person v. object) x 2 (gender: male v. female) x 4 (repetition) mixed design. The dependent variables include heart rate (as a measure of attention), skin conductance (as a measure of arousal), and encoding, storage and retrieval (measured via recognition, cued recall, and free recall). The study will also investigate whether and how gender (operationalized for simplicity as a male-female dichotomy) moderates the hypothesized relationships between variables.",Analyses of Content and Structural Features of Messages,Information Systems
2014-0013,2014,Poster,The Impact of Image Intensity and Text Color on Responses to Health Warnings,8,"Health messages from organizations are often designed to communicate the risks of unhealthy behavior in explicit warning messages. Despite these efforts, graphic and fear-inducing health warnings have been considered to potentially trigger extreme fear and defensive reactions, such as message rejection or avoidance (i.e. Ruiter, 2005). To confirm this with real-time reactions, this study will investigate how the emotional intensity of visual images and color of text used in health warning messages impacts cognitive and emotional processing of the message in a 3 (Visual Image Intensity) X 2 (Text Color) X 3 (Message) X 3 (Order) within subjects repeated measures design. Participants will view health messages that vary along three levels of visual image intensity (low, moderate, and high) and two text colors (blue and red) while psychophysiological measures of cognitive resources allocated to encoding and emotional response are recorded. The research will also assess message attitudes and perceived effectiveness.",Analyses of Content and Structural Features of Messages,Information Systems
2014-0014,2014,Poster,Variables Influencing the Likelihood of Being Reminded to a Failed Message by a Similar Communication Situation,1,"This study investigated factors that influence whether a speaker will be reminded by a current communication situation to an earlier situation where a message addressing a similar primary goal had a negative outcome. Being reminded as such may play a role in the acquisition of increasingly sophisticated adaptive ability. The study asked whether the likelihood of being reminded to an “old” situation by an analogous “new” situation is influenced by: (a) four types of similarity between the two scenarios; (b) amount of elaboration on the old scenario; (c) number of times the old scenario was thought about; and (d) extent to which the earlier episode was interesting or emotional. Results showed that participants were reminded to more old situations when they elaborated on the old situations than when not, and when the old situations were processed twice, rather than once. The situation components most predictive of reminding varied across situations.",Analyses of Content and Structural Features of Messages,Information Systems
2014-0015,2014,Poster,“Help! I’m Being Attacked by a Giant Word!” Bodily Responses to Looming Words and Pictures,6,"This paper uses dynamic human centered communication systems theory (DHCCST) to make and test predictions about differential processing of words and pictures. In general, pictures and words did show different motivational activation responses across the time course. Pictures showed greater motivational activation, while words showed lesser activation initially but showed a second firing response that generally increased motivational activation. This supported these theoretical predictions. Movement as it relates to the imminence of threats and opportunities in our environments was also investigated, but results did not follow predicted lines. Implications and future research are discussed.",Analyses of Content and Structural Features of Messages,Information Systems
2014-0016,2014,Poster,Against Policy Failure: Designing a Media System That Enables “The Good Life”,1,"Any conception of the “good life” would likely include a media system founded on normative values like openness, diversity, and information rich. Enabling freedom of speech and other essential liberties, this system would need to be accessible and affordable to all members of society. However, commercialized media systems often run counter to these ideals. American digital communication systems have become dominated by oligopolies driven by a corporate libertarian logic—one that conflated individual freedoms with corporate privilege—that does not accommodate public interest principles in line with “good life” ideals.","Extended Session: Communication Law, Policy, and the ""Good Life""",Communication Law & Policy
2014-0017,2014,Poster,Access to Knowledge and Cultivating the Good Life,1,"The Access to Knowledge [A2K] movement encompasses a broad theoretical, political and activist landscape that is concerned with the use of information and creative works outside the realm of intellectual property [IP]. A core principle of A2K is that the expansion of IP law is often anti-democratic, restrictive and an outright threat to cultural participation and creative practice. Restricting sharing, openness and access to information can prove a direct threat to “the good life” as imagined in an information society. In this position paper, I provide an overview of the problem of emerging IP enforcement regimes and explain how A2K approaches to information policy can cultivate social well-being.","Extended Session: Communication Law, Policy, and the ""Good Life""",Communication Law & Policy
2014-0018,2014,Poster,Digital Human Capital: A Policy Framework for Transitioning From Digital Exclusion to a “Good Life”,3,"***This proposal is for the Communication Policy & Law extended session on ""The Good Life"" conference theme***

This position paper argues for policymakers to implement a Digital Human Capital framework for designing ICT programs. This approach would help move marginalized community members into mainstream society through computer literacy initiatives that also address social exclusion. It has the potential to shift digitally excluded residents from a life on the periphery to, ideally, a “good life” with professional and educational opportunities.","Extended Session: Communication Law, Policy, and the ""Good Life""",Communication Law & Policy
2014-0019,2014,Poster,The Goods Life: Local Journalism From Public Good to Merit Good,1,"This position paper contributes to the discussion of how to ensure the sustainability of journalism by arguing for a rhetorical and semantic shift away from labeling journalism as a “public good” to thinking about it as a “merit good” (Musgrave, 1959). While public goods suggest regulatory intervention only to the point that “respect[s] the wishes of consumers,” merit goods suggest regulatory intervention regardless of consumption habits (Eecke, 1998, p.5). That is to say that merit goods are deemed so socially valuable that they should be provided regardless of consumer behavior. Positioning journalism as a merit good, rather than a public good lends political economic leverage for increased regulatory and legislative support for journalism, and may revive efforts to ensure the sustainability of journalism, particularly at the local level.","Extended Session: Communication Law, Policy, and the ""Good Life""",Communication Law & Policy
2014-0020,2014,Poster,The Right to Communicate as a Foundation for the Good Life,1,"This position paper argues that communication is a basic human right, and therefore a fundamental aspect of the good life. Accordingly, the right to communicate should be formally codified in international human rights law. Human rights are international norms that protect each human being from an array of abuses and seek to identify basic needs necessary to lead a minimally good life. Human rights are a “realistic utopia” in that they institutionalize the utopian ideal of a just society in the laws of modern constitutional democracies (Habermas, 2010). These rights exist as ideal statements that may be embodied in laws and regulations at local, national, or international levels. The Universal Declaration of Human Rights (United Nations, 1948) and other treaties serve as standards which identify norms to be embodied. In this regard, communication laws and policies can help to structure the good life within communities.","Extended Session: Communication Law, Policy, and the ""Good Life""",Communication Law & Policy
2014-0021,2014,Poster,Freedom of Information Laws and the Promise of “the Good Life”,1,"This paper discusses the contribution of freedom of information legislation for ""the good life"" as a tool that empowers citizen participation and makes governments more transparent.It focuses on the challenges of FOI legislation implementation in new democracies emphasizing structural barriers. It also identifies ways in which scholarship can help overcome those challenges.","Extended Session: Communication Law, Policy, and the ""Good Life""",Communication Law & Policy
2014-0022,2014,Poster,Good Life and Regulating Hate Speech Online,1,"The ICA 2014 conference them, “the good life”, can be read as a normative claim that suggests laws, regulations, and policy directions in the communication field ought to be consistent with and contributory to the goal of attaining well-being for individuals and communities. This position paper, thus, asks if tolerating hate speech in the online communication environment can be justified in the light of the good life; and what challenges and considerations ought to be discussed among communication and legal scholars.","Extended Session: Communication Law, Policy, and the ""Good Life""",Communication Law & Policy
2014-0023,2014,Poster,Position Paper: Revenge Porn: Criminalizing the Posting of Provocative Pictures When Breakups Go Bad,1,"Position Paper:

Position Paper – Communication Law & Policy and “the good life”
Revenge Porn: Criminalizing the Posting of Provocative Pictures When Breakups Go Bad

It has been dubbed “involuntary porn.” A couple breaks up and one of the parties posts once-intimate nude photos of the other all over the internet – sometimes including identifying information such as the subject’s name and address.
Hurtful and humiliating, yes. But should such cruel conduct be criminalized? That’s the law on the books now in California and New Jersey, while other jurisdictions consider outlawing “revenge porn” in the digital age.","Extended Session: Communication Law, Policy, and the ""Good Life""",Communication Law & Policy
