paper id,year,paper type,paper title,author number,abstract,session title,sub unit
2016-0034,2016,Poster,Primacy and Recency Effects of Positive and Negative Cues About Online Privacy,2,"This study aims to understand the underlying psychological mechanisms of users’ disclosing behavior in media technology use by identifying factors that either facilitate or prevent the disclosure of personal information. In particular, this study investigates how the positive (i.e., site seals) and negative interface cues (suspicious download advertisements) drive users’ attitudinal changes and decision-making regarding information disclosure, and whether the position of cues on Websites matter. It employed a 3 (first order: no cue vs. positive cue vs. negative cue) x 3 (second order: no cue vs. positive cue vs. negative cue) fully-crossed factorial between-participants online experiment (N = 146). The results show the primacy effect of a negative cue, indicating that when people evaluate a Web site, they are more likely to be influenced by first impressions formed by the presence of a negative cue. Theoretical as well as practical implications are discussed.",Emerging Problems Associated With Media Use,Information Systems
2016-0035,2016,Poster,Processing Online Privacy: Which Heuristics Matter Most?,2,"Internet users leave their digital footprints on myriad information systems each day, ranging from posting their locations on social media to conducting online transactions on shopping sites. Yet, it is still unclear how they assess the security of online systems and reveal their private information online. Some scholars presume that users carefully evaluate the benefits and risks of information disclosure, following a “privacy calculus.” However, other scholars question this proposition and claim that users are driven by cues in the interaction context, which trigger cognitive heuristics about the safety and security of specific online transactions. This study examines 18 potential heuristics via a scenario-based survey of a representative sample of US nationals (N=786) in order to identify those that most strongly predict online information disclosure. First-cut analyses of data reveal that heuristics relating to sense of community and self-presentation promote disclosure whereas those pertaining to mobility inhibit disclosure.",Emerging Problems Associated With Media Use,Information Systems
2016-0036,2016,Poster,"Unintended, Unnoticed, Troublesome: Accidental Stigmatization as Exemplar Effect",3,"Effects of single case descriptions (“exemplars”) in news on recipients’ issue perception have been repeatedly demonstrated, but little is known about unintended exemplar effects on attitudes towards social groups. Building on exemplification theory, social comparison theory, and the intersectionality hypothesis, the current study investigates if exemplar characteristics alter recipients’ general stigma-related attitudes towards individuals with a disability, and examines the role of recipient characteristics as moderators of the proposed relationships. Respondents read an article about an individual with a disability before completing a questionnaire that assessed five facets of stigmatization. Articles were manipulated regarding the gender, type of disability, immigration background, and sexual orientation of the depicted exemplar. Results support the assumption that exemplar characteristics affect readers’ general attitudes towards social groups, and that recipient variables play an important role in this process. Findings are discusses with respect to accidental stigmatization through exemplar choices and strategic anti-stigma communication.",Emerging Problems Associated With Media Use,Information Systems
2017-0000,2017,Poster,Communication Sources and Knowledge: Use of Health-Enhancing Resources Among Different Residents in a Gentrifying Neighborhood,1,"Understanding of the ways neighborhood social environments impact health is limited, with gentrifying neighborhoods offering unique opportunities to study the communication environments of two groups: newer and longer-term residents. This project seeks to analyze how residential tenure and residents’ use of media and/or interpersonal communication impact their knowledge and use of health-enhancing resources (i.e., grocery stores, farmer’s markets and community gardens, and places to exercise) during a time of rapid neighborhood change. It uses data from surveys and focus groups in a gentrifying neighborhood in Los Angeles. Preliminary analyses of data suggest that communication network composition seems to play a greater, significant role in knowledge and use of health-enhancing resources among residents who are newer to a neighborhood, with media and interpersonal communication facilitating knowledge or use of different resources. Implications and further data analyses are detailed.",Intergroup Communication Interactive Poster Session,In Event: ICA Interactive Paper/Poster Session III
2017-0001,2017,Poster,Effects of Failure on Perceptions of Underaccommodative Messages and Speakers,2,"This study examined how success or failure accomplishing a message-based goal affects people’s perceptions of underaccommodative messages and speakers. Consistent with predictions, participants who were successful on each task perceived the message as more accommodative and more clear, and inferred more positive motives and higher levels of perspective-taking by the speaker (compared to those who were unsuccessful). This study demonstrates the potential importance of instrumental outcomes to perceptions of accommodation and attributions about speakers, and in doing so contributes to our more general understanding of how people perceive communication adjustments, and make meaning, in context.",Intergroup Communication Interactive Poster Session,In Event: ICA Interactive Paper/Poster Session III
2017-0002,2017,Poster,Watching ‘Farmer Wants A Wife’ and its Relation to the Image of Those Working in Agriculture,4,"Set against the background of increasing urbanization, the study examines differences in the perceptions of people working in the agricultural sector (PWIAs) between rural and urban adolescents by means of an Implicit Associations Test (N=102) and a survey (N=127). Results indicate that urbanization of the area in which adolescents are living affects implicit and explicit perceptions of PWIAs. These differences are mediated by habitual viewing of the series Farmer Wants a Wife and are not mediated by frequency of contact with PWIAs.",Intergroup Communication Interactive Poster Session,In Event: ICA Interactive Paper/Poster Session III
2017-0003,2017,Poster,“I Have the Best Words”: Ideological Differences as Expressed in Politicians’ Language,4,"Politicians try to persuade their voters by tailoring their communication to the psychological make-up of their voters. Liberal and conservative politicians differ in the complexity of their language and the noun usage. Yet, the present study takes the multi-dimensional nature of European political system into account and theorizes that language use correlates with pro- vs. anti-European ideology. Using a computerized content analysis, we measured the complexity and noun use of politicians from seven German parties between 2006 and 2015. The results show that a higher use of nouns is correlated with anti-European ideology, while linguistic complexity is not. Contrary to the expectations, conservative politicians use more complex language. The use of nouns and complexity does not differ over time, challenging the hypothesis that language use changes during situations that cause insecurity. The findings contribute to understanding the appeal of anti-European parties and the ideological differences expressed in language.",Computational Methods Interactive Poster Session,In Event: ICA Interactive paper/Poster Session I
2017-0004,2017,Poster,A Framework for the Exploratory Open-Vocabulary Analysis of Social Media Discourse,4,"This paper proposes a methodological framework and best-practice for exploring the correlations of various language features extracted from social media posts for a given set of users. As an illustration, the framework is applied to test hypotheses about the language usage of social media users who self-report high scores on the Big Five personality trait of Openness To Experience. The results can be synthesized as visual summaries, which are face valid and allow meaningful insights into personality and behavior.",Computational Methods Interactive Poster Session,In Event: ICA Interactive paper/Poster Session I
2017-0005,2017,Poster,Battling for the Net: Big Data and Net Neutrality Activism,2,"In 2014, Federal Communications Commission (FCC)’s Chair Tom Wheeler proposed revisions to net neutrality, a regulatory concept that governs the internet, which led to nearly 4 million comments submitted to the organization by concerned citizens. Constituting the single most commented issue in the FFC’s history, the organization found itself unable to analyze the “big data” comprising the “Open Internet Docket,” the public file pertaining to net neutrality. As such, the FCC turned to data scientists at large on the internet, publicly soliciting help on their website blog and publishing the Open Internet Docket data corpus. In response to the FCC’s call, this work uses latent Dirichlet allocation (LDA) to create topic modeling of the entire corpus of comments in the Open Internet Docket (N ≈ 3.7 million). With LDA, 1000 topics were generated and manually coded by two researchers, revealing 47 salient topics containing the most unique and telling words pertaining to net neutrality. The Open Internet Docket comments contain geographic data by state, city, and zip code, so the 47 significant topics were used to run multiple linear regressions with US Census data from the American Community Survey (ACS). Results reveal that the majority of comments were concentrated in California, Texas, New York, Florida, and Illinois; linear regressions show a distinctive use of word choice in comments according to household income; and political affiliation and household income are the strongest predictors for rates of comments submitted to the FCC among the 100 most active zip codes.",Computational Methods Interactive Poster Session,In Event: ICA Interactive paper/Poster Session I
2017-0006,2017,Poster,But How Do We Store It? (Big) Data Architecture in the Social-Scientific Research Process,3,"With datasets that are growing in size and complexity, communication researchers are faced with a new problem: How do you manage these data? While methodological literature has addressed questions of collection and analyzing large-scale datasets of media data, the step in between – the systematic storage – has been largely neglected, as has been the question where to situate preprocessing within the workflow. In this paper, we situate such considerations within the social-scientific research process and offer guidelines for deciding on a suitable data architecture. We show decisions on how to store the data influence later analysis. In particular, we discuss how the choice for schema-oriented databases with a fixed tabular structure versus the choice for schema-less databases that store documents without making assumptions about their data strucutre, can play out in a communication science research context.",Computational Methods Interactive Poster Session,In Event: ICA Interactive paper/Poster Session I
2017-0007,2017,Poster,Tracing Patches: Introducing a Semiautomated Approach to Analyze Journalists’ Processing of Source Material,1,"The extent to which messages from a particular source are reproduced by others is a key question in communication research. In journalism studies for instance, there is considerable concern about journalists’ extensive reliance on subsidized content from sources and news agencies (‘churnalism’). Since journalists typically reformulate and rearrange source information rather than literally replicating it, computational approaches that focus on the literal copy-pasting of entire texts overlook an important dimension of source reliance. This study presents a semi-automated approach to trace this journalistic 'patch writing' by comparing source texts to news texts on a sentence level. In addition to offering a more refined view on churnalism, the approach can be used to study a variety of related research problems, including questions on news diversity (to what extent do news media re-purpose each other’s material?), sourcing bias (is the material of official sources systematically preferred over alternative sources?), and transparency (is the source attributed?).",Computational Methods Interactive Poster Session,In Event: ICA Interactive paper/Poster Session I
2017-0008,2017,Poster,Hot Politics: Physiological Responses to Political Communication,3,"The “hot cognition” hypothesis suggests that every political construct is emotionally charged in the brain. The initial positive and negative emotions towards politics affect the ability to make rational decisions. Negative emotions occur when a person is exposed to counter-attitudinal political communication, while positive emotions should occur when a person is exposed to pro-attitudinal political communication. The current state-of-the-art employs self-reported survey items to measure the experienced emotions which mix the emotion with a cognitive rationalization of these emotions. Accordingly, we do not know politics is hot as we would expect based upon the “hot cognition” hypothesis. In a lab-study we assessed physiological responses – arousal (Electrodermal activity; Electrocardiography) and valence (Electromyography) -- to pro-attitudinal and counter-attitudinal political communication. In a sample of 146 adults, we find that exposure to counter-attitudinal political communication increases the heart-rate with 1-2 beats per minute. Accordingly, we provide evidence that politics is indeed ‘hot’.",Social Brains: Neuroscientific Investigations on Social Influence Processes (High-Density),Communication Science and Biology
2017-0009,2017,Poster,A Neural Propagation System: Neurocognitive and Preference Synchrony in Information Sharers and their Receivers,5,"What is the essence of successful information propagation between communicators? We propose that propagation between information sharers and receivers is driven by neural synchrony in brain systems associated with subjective valuation, self-reflection, and social cognition. To test this hypothesis, we measured neural activity as well as content-related preferences in information sharers while they were exposed to news articles and in receivers exposed to sharer-composed messages about the same content. We show that neurocognitive synchrony between sharers and receivers exists selectively within the hypothesized regions of interest, and only for communication partners, not randomly paired individuals who processed the same content without interacting. Further, the extent of neurocognitive synchrony covaried with the successful propagation of content-related preferences. Our results suggest that information propagation is supported by the transmission of sharer's content evaluations through sharer-receiver synchrony in a neural propagation system consisting of regions associated with valuation, self-reflection and social cognition.",Social Brains: Neuroscientific Investigations on Social Influence Processes (High-Density),Communication Science and Biology
2017-0010,2017,Poster,Neural Correlates of Social Influence Across Socioeconomic Status,5,"People routinely change their preferences and behaviors in response to social influence. Early development, however, may change the way that the brain responds to social cues, and as such people from different cultural upbringings may be influenced through different neurocognitive pathways. Consistent with this logic, one potential moderator of brain-social influence relationships is socioeconomic status (SES). In our sample of young adults, those from high and low SES backgrounds conformed equally often; however, higher SES was associated with greater activity in one set of mentalizing (DMPFC) and positive valuation (VMPFC) regions, whereas lower SES was associated with activity in a different set of mentalizing (TPJ) and inhibitory control (inferior frontal gyrus and middle frontal gyrus) regions when conforming to peer feedback. Thus, those from high and low SES backgrounds recruit different neural processes when conforming to peer feedback, despite the fact that their ultimate behaviors appear similar on the surface.",Social Brains: Neuroscientific Investigations on Social Influence Processes (High-Density),Communication Science and Biology
2017-0011,2017,Poster,Neural Prediction of Population Sharing Behavior Relates to Domain Familiarity,5,"Sharing information is fundamental to human society, but our understanding of when and why information is shared is largely incomplete. We built predictive models that used brain responses to news articles to predict sharing of these articles in the broader population. We found 1) there were large individual differences in the predictive capacity of brain valuation responses and 2) these differences tracked with frequency of engagement with similar articles in daily life, such that frequent readers showed high ventromedial prefrontal (vmPFC) responses in general, whereas infrequent readers showed high vmPFC only to heavily shared articles. Follow-up analyses revealed that vmPFC predictivity tended to track with predictivity across a global brain network encompassing regions associated with valuation, social cognition, and controlled attention. These results provide a model of variability in brain predictive capacity for population sharing behavior, and identify individual differences in domain familiarity as a psychological source of this variability.",Social Brains: Neuroscientific Investigations on Social Influence Processes (High-Density),Communication Science and Biology
2017-0012,2017,Poster,Reproductive Effort Interacts With Socioeconomic Status to Influence Support of Censoring Government Criticisms,2,"Drawing on life-history theory, we tested an evolutionary explanation of why individuals of lower socioeconomic status (SES) are more supportive than higher SES individuals of censoring government criticisms. According to this explanation, suppressing dissent helps enforce a secure environment, which will support one’s high reproductive effort (e.g., to reproduce early and in large quantities) better than an insecure environment. Lower SES individuals have stronger desires for collective security because they generally reproduce earlier and in large quantities. Indeed, our analyses of survey data (N = 34,986) showed that household fertility partially mediated the negative correlation between SES and support of censoring government criticisms. Household fertility also interacted with SES such that its effect was stronger for higher- than for lower SES respondents. This suggests that increases in reproductive effort render higher SES individuals more risk averse. These findings qualified a system-justification hypothesis and offered a novel explanation of “working-class authoritarianism.”",Social Brains: Neuroscientific Investigations on Social Influence Processes (High-Density),Communication Science and Biology
2017-0013,2017,Poster,Say Something! Exploring Physiological Indicators of the Cyberbullying Bystander Effect,3,"Cyberbystanders have the potential to intervene on behalf of a victim when the victim is being targeted by a bully, but often choose not to. Researchers refer to this phenomenon as cyberbystander effect. It is frequently observed, yet little is known about factors that contribute to this effect. The goal of this specific experiment is to develop an initial understanding of how differing levels of message aggression induce certain physiological responses, and how those physiological responses impact subsequent intervention behavior. In this study bystanders were introduced to messages which gradually increased in the levels of aggressiveness their physiological and behavioral responses were measured. Participants felt more arousing and more negative as the level of attack severity increased. They felt less positive as aggressiveness severity of the messages increased. Physiological responses showed similar patterns. Participants avoided responding to messages with higher levels of aggressiveness severity.",Social Brains: Neuroscientific Investigations on Social Influence Processes (High-Density),Communication Science and Biology
2017-0014,2017,Poster,We Are All Psychopaths: An Investigation Into Psychopathy and Video Games,3,"Using a risk factors approach, the purpose of this study is to further understand the process that is occurring when an individual plays a violent video game.  Using a 2 (gender: male and female) x 2 (condition: control and violence) true experimental design, the individual difference variables of psychopathy and empathy are explored as traits that influence attitudinal outcomes.  This research begins with an exploration into the neurophysiological as well as the conceptual importance of empathy and psychopathy.  Finally, a mediated model of moral response is presented, which could explain why a small percentage of the population reacts with negative outcomes after playing video games. Results suggest that exposure to violence positively predicts post gameplay guilt. Furthermore, psychopathy emerged as an individual difference variable that is also able to positively predict attitudes towards violence.",Social Brains: Neuroscientific Investigations on Social Influence Processes (High-Density),Communication Science and Biology
2017-0015,2017,Poster,Autonomously Motivating Gamification in Education: An Explorative Study,2,"Researchers have been looking into gamification in education as a way to motivate students. In this paper, we argue that previous research generally lacks a nuanced, longitudinal focus on motivation and a theory-based perspective on gamification. Therefore, we present a study in which we explored the potential of autonomously motivating gamification by implementing game elements designed from a Self-Determination Theory-perspective in the Google+ communities used in a university course. By measuring the evolution in students’ motivational levels throughout a semester, interesting implications emerged. The results point to the significance of the individual nature of motivational processes, and the importance of adequate longitudinal motivation measurements distinguishing between various types of motivations. Furthermore, this paper opens the debate on using theoretical lenses when designing gamification. We end this paper by providing avenues for future research.",Game Studies Interactive Poster Session,In Event: ICA Interactive paper/Poster Session I
2017-0016,2017,Poster,"Game Engagement, Game Addiction Tendencies, and Parental Mediation of School Children",1,"A paper and pencil survey was distributed to 1890 children aged 8-16 years old in six primary and six secondary schools in Singapore. I examine the relationship between children’s game engagement and addiction tendencies and the moderation effect of parental mediation strategies-namely active and restrictive parental mediation, on this relationship. Results showed that game engagement was significantly associated with game addiction. For adolescents (12-16 years old), neither active nor restrictive parental mediation was significantly related to game addiction tendency or moderating the relationship between game engagement and game addiction tendencies. For pre-adolescents (8-11 years old), active parental mediation was positively related to game addiction regardless of children’s engagement level. However, only restrictive parental mediation moderated the relationship between game engagement and game addiction tendencies, depending on game engagement levels. For highly engaged gamers, game addiction tendency is similar regardless the frequency of restrictive parental mediation perceived. For lowly engaged gamers, higher restrictive parental mediation associates with higher addiction tendency. Theoretical and practical implications of the findings were addressed.",Game Studies Interactive Poster Session,In Event: ICA Interactive paper/Poster Session I
2017-0017,2017,Poster,Gamification as Motivator for Sustained Usage of a Speech Rehabilitation Tool,4,"Some neurodegenerative syndromes result in substantial speech impairments reducing understandability of spoken language. Speech therapy can be effective in enhancing voice loudness and articulation clearness. However, success of intervention heavily depends on frequency and intensity of training. Since such exercises are both, strenuous and boring, many patients lack the sustained motivation to keep up with their training.
Game-based technology might be able to provide these patients with the adequate tool for independent and high frequency training, tapping into empowerment of the patient users.
Game-based interventions are shown to indeed enhance motivation and motor control in patients with neurological disorders. However, evidence for exergaming in rehabilitation of speech motor skills is not yet available.
Our interdisciplinary R&D group is currently developing a rehabilitation tool (ISi-Speech) for speech therapy for patients with Parkinson’s disease implementing specific feed-back based on automated speech recognition and applying motivation theory and insights from game-based learning.",Game Studies Interactive Poster Session,In Event: ICA Interactive paper/Poster Session I
