paper id,year,paper type,paper title,author number,abstract,session title,sub unit
2015-0000,2015,Poster,Do We Trust the Crowd? Effects of Crowdsourcing on Perceived Credibility of Online Health Information,2,"Conceptualizing crowdsourcing as the system that allows users to collectively serve as the source of the content, this study examined the effects of crowdsourcing and an additional professional source layer on credibility judgments and behavioral intentions toward health messages. A 2 [crowdsourcing] × 2 [professional source] × 2 [Message topic] between-subjects online experiment (N = 189) found two indirect paths for the crowdsourcing effects. The crowd-as-source path suggests that crowdsourcing negatively affects content credibility and behavioral intentions through decreased perceived source trustworthiness and information completeness. In contrast, the self-as-source path indicates that crowdsourcing may have positive effects on perceived source trustworthiness via heightened perceived interactivity and sense of control. Finally, although the additional professional source on crowdsourcing sites raises perceived gatekeeping on the site, it does not have substantial influence on credibility judgments. The theoretical and practical implications of the findings are discussed.",CAT Interactive Papers #2,Communication and Technology
2015-0002,2015,Poster,Social TV for the Elderly: When Passive Coviewing Leads to a Better TV Watching Experience,3,"Challenges that the ageing global population faces include psychological distress, social isolation, and depression among the elderly. Due to the expensive cost and lack of resources for the treatment, active ageing (e.g., social interaction) via combined entertainment and social activities on social TV has been discussed as a new cost-effective prevention method. In this study, we report on an experiment that examined the effects of social TV (active vs. passive vs. traditional TV) on TV watching experiences among the elderly, including positive affect, enjoyment, perceived quality of social interaction, sense of belonging to the senior center, intention to participate in a community activity, and intention to use social TV in the future. The results (n = 144) showed significant main effects of passive social TV on positive affect, TV enjoyment, sense of belonging, and intention to participate in a community activity. In addition, the results of mediation analyses showed that positive affect mediated the effect of social TV on all the measured variables. Implications regarding the potential of social TV in enhancing the general well-being of the elderly and promoting active ageing are discussed.",CAT Interactive Papers #2,Communication and Technology
2015-0003,2015,Poster,I-Nakba and the Right to Memory: Remembering the Unremembered Through New Media,2,"This high-density session presentation presents and analyzes the iNakba mobile device app that was launched in 2014 by ""Zochrot"" (Remember in Hebrew), an Israeli NGO. The iNakba demonstrates the unique capabilities of new media in promoting the right to memory of a marginalized community. The presentation explicates the theoretical foundations of “the right to memory,” a recent addition to the growing literature on collective memory. A demonstration of the app on a poster and an accompanying screen will address three goals: an explication of a recently introduced and scarcely discussed term: the right to memory; a contextualization of the use of contemporary interactive and collaborative applications (commonly referred to as “social media”) as empowering tools for silenced memories of marginalized communities; and an application of the authors’ theory of “new” and “social” media based on a distinct characterization of these media and the ways they differ from their predecessors.",CAT Interactive Papers #2,Communication and Technology
2015-0004,2015,Poster,Make it Interactive and They Will Come: Correlating Interactivity in Antidrug Websites With Site Traffic,2,"As preventive health campaigns move to the Internet for attracting larger and younger audiences, it is important to understand the contributions made by the affordances of online media. Interactivity is often touted as an important characteristic, but we do not know if it contributes to greater usage of online health campaigns. To address this issue, we content-analyzed 94 anti-drug websites in the US, in order to assess the extent to which they feature three dominant types of interactivity. This data was compared with website traffic data from Alexa.com. We discovered that the number of interactive gadgets and the total frequency of the three types of interactivity significantly predicted global ranking of the website as well as the number of daily page-views per visitor. The frequency of modality interactivity and the presence of source interactivity on the homepage were particularly useful in predicting website ranking. Theoretical and practical implications are discussed.",CAT Interactive Papers #2,Communication and Technology
2015-0005,2015,Poster,Persuasion Effects of Web Interactivity: A Meta-Analysis,2,"Web interactivity in recent years has attracted increasing academic attention. Unlike traditional media, online media can utilize lots of new functions including web interactivity to engage and interact with users. To examine the extent to which web interactivity can affect persuasion in prior research, we conducted a meta-analysis of 30 studies (N=5335) that met our selection criteria. The results reveal that high web interactivity is consistently more effective in eliciting users’ positive attitudes and intentions compared to low level of interactivity; with this said, users don’t necessarily form positive attitudes when there is too much interactivity. Despite the promise on persuading attitudes and intentions, no significant persuasion effect of web interactivity has been found on cognitive responses and memory. In addition, perceived interactivity shows a significantly larger persuasion effect as opposed to objective interactivity. Theoretical and practical implications are discussed in this paper.",CAT Interactive Papers #2,Communication and Technology
2015-0006,2015,Poster,Big Data or Small Stories? Exemplification and Interactivity Effects on Shaping Perceptions and Attitude of Social Issues,2,"With the rising popularity of “big data”, journalists are trying to integrate data-rich information into news content and to make them accessible to everyday news readers by accompanying them with exemplifying cases. But, these exemplars do not always fully capture the complexity of the data patterns, yet they end up playing an important role in shaping user perceptions of the issue. This study examines the effectiveness of interactivity in counteracting the strong exemplification effect through enhancing perceived vividness of, and user engagement with, data-rich information. A 2 (baserate-exemplar consistency) × 3 (presentational format) × 2 (issue topic) mixed-design experiment revealed that, compared to textual description and static visualization, interactive visualization is effective in motivating systematic processing of the baserate information, which positively influences accuracy of issue perception as well as personal attitude. The study generates both theoretical and practical implications on journalistic practices and interface designs for communicating big-data information.",CAT Interactive Papers #2,Communication and Technology
2015-0007,2015,Poster,Climate Change and Technology: Examining Opinion Formation and Risk Perceptions of Geoengineering,1,"In recent years, ‘climate change’ has matured from a technical term employed by scientists and policy-makers to a social, political, and moral locus that has garnered widespread media coverage, public interest, and debate around the world. As evidence demonstrating the anthropogenic influence on the Earth’s climate has steadily grown stronger, climate change has come to be seen as a pre-eminent challenge of the 21st century. Until recently, most discourse regarding potential responses to anthropogenic climate change have focused on two categories of response options 1) emission mitigation (reducing greenhouse gas emissions), and 2) human adaptation to a changing world (Mercer, Keith and Sharp, 2011). Geoengineering, a set of proposed large-scale technological fixes to reduce or neutralize greenhouse gas emissions, is a third emerging category of response to global climate change. This study seeks to understand which factors contribute, or alternatively, subtract from public acceptance of geoengineering through predictive hierarchical OLS regression modelling of public perceptions of a variety of factors including socio-demographics, value predispositions, and media use. Such predictive modelling can enable risk communicators and policy-makers with vital information to improve future public engagement and communication about geoengineering.",Environmental Communication Interactive Poster Session,In Event: ICA Plenary Interactive Paper/Poster Session II
2015-0008,2015,Poster,Effects of Similarity and Framing on Narrative Environmental Risk Communication,3,"Environmental risks threaten both human health and nonhuman entities. It was predicted that framing an environmental risk as a human health risk would improve persuasive outcomes of a message. Further, it was expected that similarity between the audience and the people and places depicted in the message would also improve message outcomes. Two types of similarity (demographic similarity and scene similarity) were manipulated in a 2 (risk frame: health, environmental) × 2 (demographic similarity: high, low) × 2 (scene similarity: high, low) between-subjects experiment (N = 568), in which participants were exposed to a message about drought framed as either a health or an environmental risk. Scene similarity interacted with message frame (health vs. environmental) for narrative persuasion and behavior-related variables. Specifically, high (versus low) scene similarity resulted in better persuasive outcomes for the health frame than for the environmental frame, whereas low (versus high) scene similarity resulted in better persuasive outcomes for the environmental frame than for the health frame. Additionally, the study found that framing an environmental risk as a health risk increased behavioral intention and behavioral expectation. Furthermore, high (versus low) personal relevance improved risk perception, narrative persuasion, behavioral intention and expectation, and response efficacy. The study has implications for health and environmental risk communication, particularly for impersonal risks that people perceive to be of low personal relevance, and opens up new avenues for research and practice in areas such as climate change communication and entertainment-education. Limitations, implications, and recommendations for replications and extensions are discussed.",Environmental Communication Interactive Poster Session,In Event: ICA Plenary Interactive Paper/Poster Session II
2015-0009,2015,Poster,Engaging Nuclear Publics: Mediations Across Civil and Political Society,1,"I analyze the documentary coverage of a public hearing held in June 2007 that was debating the Environmental Impact Assessment Report related to atomic power plants in Koodankulam, Southern India and my own fieldwork of the People’s Convention on Nuclear Energy in Ahemdabad during July 2013. Through an engagement with postcolonial empirical contexts, I problematize the deliberative model related to public participation in environmental decision-making. Drawing on Partha Chatterjee’s (2004) work, I analyze the Indian nuclear establishment’s ways of differentially addressing some stakeholders in the environmental controversy as scientific-citizens belonging to the “civil society” and others as scientifically illiterate populations belonging to “political society.” Such a governmental approach, I argue, serves to perpetuate the experts-laypersons divide and thereby fails to emerge with expertise that could be a “public resource” by integrating scientific knowledge with local concerns (Kinsella, 2004).",Environmental Communication Interactive Poster Session,In Event: ICA Plenary Interactive Paper/Poster Session II
2015-0010,2015,Poster,Evaluating Image Repair Strategies of CRU Scientists and IPCC After the Climategate and Glaciergate Crises,1,"In November 2009, more than 1000 emails between prominent climate scientists at Climatic Research Unit (CRU) were leaked days before the COP 15 summit in Copenhagen, where the world leaders congregated to act on global warming. The resulting public controversy, dubbed 'climategate', cast doubt on the credibility of the scientists, the CRU, the Intergovernmental Panel on Climate Change (IPCC) and on the science supporting anthropogenic climate change. This paper uses the Image Repair Theory (Benoit, 1997) to examine the communication strategies of the parties involved. Nine investigations, press releases, newspaper articles, and blogs were analyzed to identify image repair strategies of the scientists, the CRU and IPCC. Analysis suggests that denial, attacking the skeptics, and bolstering were prominently used by the three parties, in different measures with relative success. This paper suggests the potential for, and the need to investigate inter-organizational crisis communication to assist in reputation management, as crisis often engulfs multiple rhetors.",Environmental Communication Interactive Poster Session,In Event: ICA Plenary Interactive Paper/Poster Session II
2015-0011,2015,Poster,Linking Sadness Appeal With Gain and Hope Appeal with Loss: Communicating a Novel Marine Disease,1,"The recent appearance of the sea star wasting disease among thousands of sea stars along the U. S. west coast has attracted substantial attention. In response to this novel environmental issue, two experiments were conducted to examine the effectiveness of two emotional appeals. Experiment 1 compared a sadness appeal, a hope appeal and a control condition (no message), and found that, in general, both the sadness appeal and the hope appeal were more persuasive than the control condition in heightening a number of behavioral intentions, such as support for policies, information seeking, and pro-marine environment behaviors. Experiment 2 not only compared the sadness appeal and the hope appeal with a neutral message condition, but also investigated the interaction effects of the two emotional appeals with gain versus loss frame. This experiment provides initial evidence that a sadness appeal will be more effective when it is accompanied by a gain frame and that a hope appeal tends to have greater impacts when it is juxtaposed with a loss frame.",Environmental Communication Interactive Poster Session,In Event: ICA Plenary Interactive Paper/Poster Session II
2015-0012,2015,Poster,The CSR Green Halo Effect on the Corporate-Public Communication: An Experimental Study,3,"Consumers may not be happy with the intrusive ads that they are forced to be exposed to. However, their exposure to a company’s environmental CSR activity sometimes compensates their aversion with the ads, and even makes them more tolerant of being annoyed. Through a controlled experimental design, this study examines the impacts of support for environmental CSR activities on ad avoidance and consequently on brand evaluation. We found that, the impact of a company’s environmental CSR activity may not help boost the company’s popularity among the consumers, but it certainly can help the company be less averted. The CSR green halo effect therefore has great implication for corporate-public communications, especially during time of crisis.",Environmental Communication Interactive Poster Session,In Event: ICA Plenary Interactive Paper/Poster Session II
2015-0013,2015,Poster,"Social Identity Theory, Gender Differences, and Gender Role Beliefs in Understanding Homophobia",1,"Abstract
Homophobia is found to cause anti-gay violence. Research has endeavored to examine correlates and causation of homophobia to better understand and to effectively intervene.
This study used online surveys to examine whether or not social identity theory (SIT) predicted male and - previously underexplored - female homophobia, whether or not there was a gender difference in homophobia and gender role beliefs, and whether or not homophobia and gender role beliefs were correlated. The results showed that social identity theory predicted only female homophobia (RQ1) but not male homophobia (H1), there was a gender difference in homophobic attitude (RQ2a) but not in gender role beliefs (RQ2b), and homophobia and gender role beliefs were positively and significantly correlated with homophobia in both males and females (RQ3).","Lesbian, Gay, Bisexual, Transgender, and Queer Studies Interactive Paper Session",In Event: ICA Plenary Interactive Paper/Poster Session I
2015-0014,2015,Poster,The Moderating Effects of LGBTQ Television Narratives on Rehearsal Imagined Interactions and LGBTQ Identity Disclosure,1,"This paper explores the linkage between rehearsal imagined interactions and coming out stories, specifically how attitudes about LGBTQ portrayals on television moderate the use of rehearsal imagined interactions on attitudes and openness in LGBTQ identity disclosures. Using imagined interaction theory (IIT), we found significance in the moderation using a mixed methods approach. We also developed an additional characteristic scale to add to current IIT measurements, the Parasocial Characteristic Scale.","Lesbian, Gay, Bisexual, Transgender, and Queer Studies Interactive Paper Session",In Event: ICA Plenary Interactive Paper/Poster Session I
2015-0015,2015,Poster,"The Relationship Between Computer-Mediated Communication, Identity, and Well-Being Among Lesbian, Gay, and Bisexual Adolescents",2,"Research suggests that LGB adolescents engage in computer-mediated communication (CMC) more so than their heterosexual peers and that doing so may provide LGB teens with a space to experiment with their sexual identities, find social support, and create community. Grounded in the media practice model, the purpose of this study was to examine the mediating role of sexual identity commitment in the relationship between CMC engagement and well-being among a sample of LGB adolescents. Results indicate that LGB teens engage in approximately four hours of CMC a day. Results also suggest that CMC is positively correlated with well-being and that said relationship is partially mediated by sexual identity commitment, but only for LGB female adolescents. No relationship existed between CMC and sexual identity commitment or well-being among males. Findings are discussed in terms of gender differences.","Lesbian, Gay, Bisexual, Transgender, and Queer Studies Interactive Paper Session",In Event: ICA Plenary Interactive Paper/Poster Session I
2015-0016,2015,Poster,"The Power of a Protest Icon: How Anger, Solidarity, and Subjugation Converged in “Hands Up, Don’t Shoot” in Ferguson, Missouri",5,"The August 9, 2014 fatal shooting of Michael Brown, an unarmed African American teenager by a Caucasian police officer in Ferguson, Missouri triggered intense public discourse, civil unrest and massive social protests, resonating not only within the African American working-class suburb of St. Louis but both nationally and globally. Our goal with this paper is to contribute to understandings of the construction of race through visual media, both in news coverage and in citizens’ creation and disseminationof images on social networks. In this paper we follow and interpret the contagion of the “Hands Up, Don’t Shoot” protest gesture as its various performances were captured on Internet imagemacros through the lenses of Critical Race Theory and Symbolic Convergency Theory.",Ethnicity and Race in Communication Interactive Poster Session,In Event: ICA Plenary Interactive Paper/Poster Session I
2015-0017,2015,Poster,"Producing a Crossover Fail: A Case Study of Latin Pop Star ""Nigga""/Flex",1,"This paper highlights a Latin pop star known as “Flex” in the US and as “Nigga” across Latin America. As part of the Latin music industry’s global launch of this artist, Internet fan outreach and viral marketing strategies were devised to divert attention from the “Nigga” moniker by rebranding and repackaging him as “Flex.” Yet, the use of a racially charged moniker and dual marketing strategies worked against his global branding appeal and produced a crossover fail. Through Internet discourse analysis, I examine four social networking fan pages maintained (2007-2008) under each moniker. This case study is particularly compelling, as it analyzes how representations of Blackness and Latinidad are produced in a hegemonic system that depends on uneven access to power. Extending critical work on Latin popular culture, it also interrogates the pressures of race, nation, and commodification on Latin crossover artists producing and globally circulating representations of Blackness and Latinidad.",Ethnicity and Race in Communication Interactive Poster Session,In Event: ICA Plenary Interactive Paper/Poster Session I
2015-0018,2015,Poster,Testimonies of Race-Based Suffering: Individual Differences in Openness to the Other,1,"The present study employed a variety of existing measures to assess openness to the other in the ecologically valid context of listening to real-life testimonies of race-based suffering. Variation in symbolic threat, as well individual differences in Right Wing Authoritarianism (RWA) and Social Dominance Orientation (SDO), were all investigated for their impact on respondent openness. Among 39 student volunteers it was found that a woman's testimony featuring a high degree of symbolic threat engendered less openness to the other across cognitive and affective measures than less threatening testimony offered by a man. Additionally, participant levels of RWA and SDO explained a significant amount of variance in their openness to the other. This study quantitatively confirms that testimonies of race-based suffering- utterances that have great potential to interrupt master narratives and invite deep learning- are likely to be met with a complex pattern of resistance that must be more fully understood.",Ethnicity and Race in Communication Interactive Poster Session,In Event: ICA Plenary Interactive Paper/Poster Session I
2015-0019,2015,Poster,The Representations of the Minority Group in the Traditional Print Media of Singapore: A Comparative Content Analysis,5,"Singapore is a multi-racial society, with the Chinese forming the dominant ethnicity group and the Malays forming the largest minority group. Scholars have long used the media to study the identity formation and the society’s perception of the minority group. This paper adopts the content analysis methodology and Clark’s model of four-stage minority media representations to analyze the portrayal of the Malays in Singapore’s The Straits Times print newspaper, followed by a comparison with the dominant Chinese’s media representations for further insights into practical nation building strategies. Results from 970 articles (articles from 1965-2001) show an interesting pattern. Implications for the model are discussed.",Ethnicity and Race in Communication Interactive Poster Session,In Event: ICA Plenary Interactive Paper/Poster Session I
2015-0020,2015,Poster,"“To Learn the Society of the US, I See those Channels”: Refugees’ Use of Media During Ongoing Resettlement",1,"This project considers how refugees encounter, interpret, and use media as a conduit for acculturation during long-term processes of ongoing resettlement that take place after their arrival in the United States. Drawing on insights provided by seventy-four oral history interviews with refugees from Bhutan, Burma (Myanmar), Iraq and Somalia in the four states that accepted the most refugees in 2012—Texas, California, New York and Pennsylvania—this paper explores the interaction of media, language, and religion and demonstrates the ways that these three phenomena are inextricably linked in refugees’ lives. Moreover, the refugee narrators reveal, in their own word, the role of media in maintaining or negotiating connections between displaced families and friends.",Ethnicity and Race in Communication Interactive Poster Session,In Event: ICA Plenary Interactive Paper/Poster Session I
2015-0021,2015,Poster," Cultural Competence Development, Critical Service-Learning, and Latina/o Youth Empowerment: A Qualitative Case Study",2,"As more and more universities create service-learning programs to engage students with the community, educators are still experimenting with pedagogical approaches and practices to enhance learning outcomes while benefiting the communities they serve. In this paper, we present a qualitative case study of a service-learning program that aimed to enable media and journalism undergraduate students to enhance their cultural competence and sense of citizenship while simultaneously empowering working-class high school Latina/o students. We discuss the program’s conceptualization as a social justice empowerment effort grounded in Paulo Freire’s critical pedagogy. We address the challenges of creating and sustaining the program, and focus on its value for both undergraduates and Latina/o high-school students. We also discuss lessons learned and practical implications for other service-learning programs.",Ethnicity and Race in Communication Interactive Poster Session,In Event: ICA Plenary Interactive Paper/Poster Session I
